{
  "envelope_version": "1.0",
  "doc_type": "question",
  "subject": "BAN",
  "class_level": 5,
  "curation_tag": "KEEP_AS_IS",
  "review_status": "draft",
  "provenance": {
    "source_project": "P04",
    "author": "amendment-test",
    "content_version": "v1"
  },
  "tags": {
    "topic_tag": "TOP-BAN-C5-05",
    "difficulty": "medium",
    "bloom_level": "Understand",
    "paper_role": "structured"
  },
  "payload": {
    "qid": "QP-BAN-C5-U17-Q08001",
    "topic_tag": "TOP-BAN-C5-05",
    "ref19_topic_id": "BAN-INFOTEXT",
    "question_text": "উয়ারী-বটেশ্বরে প্রাচীন নগরের সন্ধান কীভাবে পাওয়া গেল — ব্যাখ্যা করো।",
    "question_type": "descriptive",
    "paper_role": "structured",
    "bloom_level": "Understand",
    "difficulty": "medium",
    "tier": "tier1",
    "marks": 5,
    "rubric": {
      "bands": [
        "4",
        "3",
        "2",
        "1"
      ],
      "criteria": [
        {
          "role": "content",
          "criterion": "বিষয়ের সঠিকতা",
          "band_descriptors": {
            "1": "মিল নেই",
            "2": "আংশিক মিল",
            "3": "অধিকাংশ মিল",
            "4": "কবিতার ভাবের সঙ্গে সম্পূর্ণ মিল"
          }
        },
        {
          "role": "reasoning",
          "criterion": "যুক্তি/কারণ",
          "band_descriptors": {
            "1": "কোনো কারণ নেই",
            "2": "দুর্বল কারণ",
            "3": "সীমিত কারণ",
            "4": "স্পষ্ট কারণসহ"
          }
        },
        {
          "role": "islamic_alignment",
          "criterion": "ইসলামি/নৈতিক সঙ্গতি",
          "band_descriptors": {
            "1": "অনুপযুক্ত",
            "2": "সংশোধন প্রয়োজন",
            "3": "অধিকাংশ সঙ্গতিপূর্ণ",
            "4": "মাতা-পিতার আনুগত্যের আদবের সঙ্গে পূর্ণ সঙ্গতিপূর্ণ"
          }
        }
      ]
    }
  }
}